topic,content
technology,자동차 임대업
product,쏘카
service,어플리케이션을 통한 카 쉐어링 자동차 임대업
introduction,"우리는 모빌리티 혁신을 통해 세상을 움직입니다.

인류의 역사는 이동의 역사입니다. 수천 년 전부터 우리는 늘 어디론가 이동해왔습니다.
때로는 생존을 위해, 때로는 소중한 사람을 만나기 위해. 그리고 가끔은 미지의 세계에 대한 호기심에 이끌려서.

목적이나 방식은 달랐지만, 이동에 대한 인류의 바람은 언제나 같았습니다.
언제 어디서나 내가 원할 때, 편리하고 안전하게 이동하고 싶다는 마음. 그 열망은 자동차를 탄생시켰고, 인류의 삶은 다른 챕터를 시작했습니다.

자가용은 우리에게 평일에는 편안함을, 주말에는 즐거움을 선사했습니다. 하지만 원치 않은 변화도 가져왔습니다. 산과 숲은 도로로 변했고, 클랙슨과 매연은 도시의 일상이 되었습니다. 약속 장소로 가는 꽉 막힌 도로에서 우리는 초조함을 느꼈고, 아파트의 비좁은 주차장은 퇴근길 스트레스로 다가왔습니다.

쏘카는 자동차라는 수단을 넘어 이동에 대한 사람들의 오랜 바람을 다시 떠올립니다. 우리는 차를 소유하며 당연하게 여겼던 불편함과 비효율을 줄이고, 기술과 데이터에 힘입어 더 나은 이동 방식을 제시하겠습니다. 이동의 본질을 찾기 위해 세상에 존재하는 쏘카와 함께 사람들은 즐거운 기억을 쌓고, 다양한 경험을 하고, 새로운 기회를 접할 것입니다."